<xs:schema xmlns:xs="http://www.w3.org/2001/XMLSchema">

    <xs:element name="cine">
        <xs:complexType>
            <xs:sequence>
                <xs:element name="pelicula" maxOccurs="unbounded">
                    <xs:complexType>
                        <xs:sequence>
                            <xs:element name="titulo" type="xs:string"/>
                            <xs:element name="director" type="xs:string"/>
                            <xs:element name="anio" type="xs:integer"/>
                        </xs:sequence>
                    </xs:complexType>
                </xs:element>
            </xs:sequence>
        </xs:complexType>
    </xs:element>

</xs:schema>
